{
  "ledger_version": "0.1.0",
  "authority": "Quirk-Systems/.github",
  "snapshot": "2026-08-21",
  "scope": {"expected_open_non_dependabot_pull_request_count": 30},
  "pull_requests": [
    {"id":"Quirk-Systems/quirk-os#24","repository":"Quirk-Systems/quirk-os","number":24,"title":"admission evidence for Sync Control Plane v0.2","draft":false,"age_days":8,"check_state":"Golden Gates success; Sync Control Plane success; 9 review comments","base":"main","head":"copilot/sync-control-plane-v0-2","decision":"revise","rationale":"Six substantive review findings contradict admission claims: incomplete projection reconstruction, no schema self-approval rejection, incomplete append-only exercise, partial mapping proof, false no-merge claim, and unresolved PR #3 blockers. Human admission remains required.","successor":"Same PR after evidence is corrected and blockers are explicit."},
    {"id":"Quirk-Systems/quirk-os#23","repository":"Quirk-Systems/quirk-os","number":23,"title":"manifest admission and append-only invariants","draft":true,"age_days":8,"check_state":"Golden Gates action_required; SCP action_required","base":"main","head":"copilot/protect-manifest-admission","decision":"revise","rationale":"Draft with blocked checks; tests/evidence must address the append-only and admission-proof gaps surfaced on #24.","successor":"Same PR, or a narrowed replacement paired with #24."},
    {"id":"Quirk-Systems/project-scaffold#84","repository":"Quirk-Systems/project-scaffold","number":84,"title":"restore missing yaml dependency","draft":true,"age_days":8,"check_state":"Semantic success; CI failure","base":"main","head":"claude/affectionate-albattani-4erx6a","decision":"revise","rationale":"Small correct-shaped repair, but branch is dirty and CI fails; rebase and isolate lockfile proof.","successor":"Same PR."},
    {"id":"Quirk-Systems/quirk-os#41","repository":"Quirk-Systems/quirk-os","number":41,"title":"QIS-016 fallback equivalence","draft":true,"age_days":8,"check_state":"Golden Gates action_required","base":"main","head":"copilot/qis-016-prove-plain-fallback-equivalence","decision":"close","rationale":"Head reports zero changed files and is a stale child candidate; no reviewable independent delta remains.","successor":"Future consolidated QIS PR."},
    {"id":"Quirk-Systems/quirk-os#36","repository":"Quirk-Systems/quirk-os","number":36,"title":"QIS-013 blinded counterfactual","draft":true,"age_days":8,"check_state":"Golden Gates action_required","base":"main","head":"copilot/qis-013-run-blinded-counterfactual","decision":"close","rationale":"Zero changed files plus blocked gate; no reviewable independent delta remains.","successor":"Future consolidated QIS PR."},
    {"id":"Quirk-Systems/quirk-os#39","repository":"Quirk-Systems/quirk-os","number":39,"title":"deterministic generated-UI reconstruction","draft":true,"age_days":8,"check_state":"SCP/QIS/skill/Golden Gates all action_required","base":"main","head":"copilot/qis-015-prove-deterministic-ui-reconstruction","decision":"supersede","rationale":"Dirty stacked candidate with four blocked gates; reconstruction proof must be rebased on the admitted QIS contract and include end-to-end evidence.","successor":"Future consolidated QIS PR."},
    {"id":"Quirk-Systems/quirk-os#37","repository":"Quirk-Systems/quirk-os","number":37,"title":"generated-UI admission gate","draft":true,"age_days":8,"check_state":"SCP/skill/QIS/Golden Gates all action_required","base":"main","head":"copilot/qis-014-build-fail-closed-gate","decision":"supersede","rationale":"Dirty stacked candidate; it cannot be assessed independently from the unresolved QIS base.","successor":"Future consolidated QIS PR."},
    {"id":"Quirk-Systems/quirk-os#35","repository":"Quirk-Systems/quirk-os","number":35,"title":"candidate-only Copilot admission harness","draft":false,"age_days":8,"check_state":"skills/QIS/harness/SCP/Golden Gates all action_required","base":"main","head":"copilot/qis-harness-install-candidate-engine","decision":"supersede","rationale":"Dirty, multi-gate blocked, and overlaps the later QIS evidence chain; rebuild a minimal harness only after contract admission.","successor":"Future consolidated QIS PR."},
    {"id":"Quirk-Systems/quirk-os#38","repository":"Quirk-Systems/quirk-os","number":38,"title":"personalization runtime scope grants","draft":true,"age_days":8,"check_state":"Golden Gates action_required","base":"main","head":"copilot/qis-018-enforce-permitted-personalization","decision":"close","rationale":"Zero changed files and blocked gate; keep the requirement in the QIS backlog, not an empty PR.","successor":"Future consolidated QIS PR."},
    {"id":"Quirk-Systems/quirk-os#40","repository":"Quirk-Systems/quirk-os","number":40,"title":"preference summaries / correction flow","draft":true,"age_days":8,"check_state":"Golden Gates action_required","base":"main","head":"copilot/qis-017-make-preference-summaries-inspectable","decision":"close","rationale":"Zero changed files and blocked gate; the preference boundary is not yet settled.","successor":"Future consolidated QIS PR."},
    {"id":"Quirk-Systems/quirk-os#25","repository":"Quirk-Systems/quirk-os","number":25,"title":"Deck Grammar v0.1","draft":true,"age_days":8,"check_state":"Golden Gates/SCP/Deck Grammar success","base":"agent/quirk-intent-shaper","head":"agent/deck-grammar-candidate-pack","decision":"hold","rationale":"Green but deliberately stacked on #15 rather than main; human must decide the Intent Shaper base and deck-vs-canon boundary first.","successor":"Quirk-Systems/quirk-os#15 as prerequisite."},
    {"id":"Quirk-Systems/quirk-os#21","repository":"Quirk-Systems/quirk-os","number":21,"title":"canonical/runtime mapping v1.1","draft":true,"age_days":8,"check_state":"Golden Gates/SCP action_required; 2 review comments","base":"main","head":"copilot/stabilize-canonical-runtime-mapping","decision":"supersede","rationale":"Mapping claims are challenged in #24 review; replace with complete-object, runtime-leg, loss-accounting proof.","successor":"Fresh mapping proof PR after #24 correction."},
    {"id":"Quirk-Systems/quirk-os#17","repository":"Quirk-Systems/quirk-os","number":17,"title":"admit Intent Shaper candidate","draft":true,"age_days":8,"check_state":"SCP/Golden/QIS/skill all action_required","base":"main","head":"copilot/admit-quirk-intent-shaper","decision":"supersede","rationale":"Dirty duplicate/parallel admission path to #15; do not merge a second root candidate.","successor":"Quirk-Systems/quirk-os#15."},
    {"id":"Quirk-Systems/quirk-os#22","repository":"Quirk-Systems/quirk-os","number":22,"title":"projection-adapter vertical slice","draft":true,"age_days":8,"check_state":"Golden Gates/SCP action_required","base":"main","head":"copilot/run-bounded-projection-adapter","decision":"supersede","rationale":"Drift, idempotency, and reconstruction assertions need corrected SCP admission evidence and live-adapter proof.","successor":"Fresh scoped adapter PR after #24 correction."},
    {"id":"Quirk-Systems/quirk-os#18","repository":"Quirk-Systems/quirk-os","number":18,"title":"projection envelopes and regeneration receipt","draft":true,"age_days":8,"check_state":"SCP/Golden Gates action_required","base":"main","head":"copilot/quirk-os-7-project-v0-2-evidence","decision":"supersede","rationale":"#24 review establishes adapter rebuild/writeback is not proven; a corrected proof must replace this claim.","successor":"Fresh projection-reconstruction proof PR."},
    {"id":"Quirk-Systems/quirk-os#15","repository":"Quirk-Systems/quirk-os","number":15,"title":"Intent Shaper v0.1","draft":true,"age_days":9,"check_state":"Intent Shaper/Golden Gates/SCP success","base":"main","head":"agent/quirk-intent-shaper","decision":"hold","rationale":"Green candidate, but draft and dirty. It sets a consequential personalization boundary and requires human admission/owner decision before rebase and review.","successor":null},
    {"id":"Quirk-Systems/quirk-os#20","repository":"Quirk-Systems/quirk-os","number":20,"title":"Cloudflare inventory / DEFER_UNBOUND","draft":true,"age_days":8,"check_state":"SCP/Golden Gates action_required","base":"main","head":"copilot/resolve-cloudflare-bounded-edge-role","decision":"hold","rationale":"Provider scope and human decision remain unresolved; do not merge a branch with blocked controls.","successor":"Same intent in a post-admission provider ADR PR."},
    {"id":"Quirk-Systems/quirk-os#19","repository":"Quirk-Systems/quirk-os","number":19,"title":"RFC discussion seed","draft":true,"age_days":8,"check_state":"Golden Gates action_required","base":"main","head":"copilot/enable-github-discussions","decision":"close","rationale":"GitHub Discussions is disabled; documentation seed cannot satisfy the claimed publication action and is gate-blocked.","successor":"Reopen only after Discussions is enabled and an owner/category exist."},
    {"id":"Quirk-Systems/quirk-core#1","repository":"Quirk-Systems/quirk-core","number":1,"title":"anti-limiting classification doctrine","draft":true,"age_days":9,"check_state":"No workflow returned","base":"main","head":"agent/anti-limiting-classification-doctrine","decision":"hold","rationale":"Candidate doctrine may be valuable, but quirk-core has no settled core responsibility, owner, consumer, or required checks.","successor":"Decide fold into quirk-os or define distinct core contract."},
    {"id":"Quirk-Systems/.github#6","repository":"Quirk-Systems/.github","number":6,"title":"feat(governance): bind truthful topology to evidence","draft":true,"age_days":9,"check_state":"Governance Contracts success (run 32446459859); mergeable clean","base":"main","head":"agent/separate-project-scaffold-and-quirk-os","decision":"merge","rationale":"Corrects the active topology, classifies all repositories and manual PRs, and adds byte-bound evidence checks; owner review and ruleset activation remain explicit.","successor":null},